housekeeping;n. công việc quản gia. Eg: (also adjective) ___ duties.
however;adv. tuy vậy, song. Eg: It would be nice if we had more money. However, I suppose we’ll manage with what we have.
howl;v. rú, hú. Eg: The wolves ___ed
huge;adj. khổng lồ. Eg: a ___ dog
hum;v. ngậm miệng ngân nga. Eg: He was ___ming a tune to himself.
humane;adj. nhân đạo. Eg: a ___ man
humanitarian;adj. nhân đạo. Eg: ___ aid.
humble;adj. khiêm tốn, nhún nhường. Eg: You have plenty of ability but you’re too ___.
humid;adj. ẩm. Eg: a ___ climate.
humiliate;v. làm nhục. Eg: He was ___d to find that his girlfriend could run faster than he could.
hummingbird;n. chim ruồi
hunger;n. tình trạng đói. Eg: A cheese roll won’t satisfy my ___.
hurricane;n. bão. Eg: They forecast a ___ for the Southeastern US.
hurry;v. thúc giục. Eg: You’d better ___ if you want to catch that bus
hut;n. túp lều. Eg: a wooden ___.
hydrogen;n. Hyđrô
hyena;n. linh cẩu
hygiene;n. vệ sinh. Eg: dental ___.
hygienic;adj. hợp vệ sinh. Eg: Hygienic conditions are essential in a hospital.
hypothesis;n. giả thuyết
ideal;adj. lý tưởng. Eg: This tool is ___ for the job I have in mind.
identical;adj. giống hệt. Eg: They wore ___ dresses.
identify;v. nhận ra, nhận dạng. Eg: Would you be able to ___ the man who robbed you?
ideological;adj. thuộc hệ tư tưởng. Eg: ___ change in the British Conservative Party.
ideology;n. hệ tư tưởng. Eg: Marxist ___.
idiom;n. thành ngữ. Eg: ‘To kick the bucket’ is an informal ___ meaning ‘to die’.
idiot;n. kẻ ngốc. Eg: She was an ___ to give up such a good job.
idle;adj. nhàn rỗi. Eg: Several fishing boats were lying ___ in the harbour/harbor.
ignorance;n. sự không biết, sự ngu dốt. Eg: the general public’s ___ about the disease.
ignorant;adj. không biết, ngu dốt. Eg: He’s really very ___ – he ought to read more
ignore;v. không để ý. Eg: He ___d all my warnings.
illuminate;v. thắp sáng. Eg: The gardens were ___d by rows of lamps.
illusion;n. ảo tưởng. Eg: an optical ___.
image;n. tượng. Eg: Images of the saints adorned the walls.
imagine;v. tưởng tượng. Eg: I can ___ how you felt.
imitate;v. bắt chước. Eg: Children ___ their friends rather than their parents
immediate;adj. ngay lập tức. Eg: an ___ response.
immense;adj. rộng lớn. Eg: an ___ forest
immigrant;n. nhập cư. Eg: The eastern part of the city is inhabited by ___s
immune;adj. miễn khỏi. Eg: He is ___ to measles
impact;n. sự va chạm. Eg: The bomb exploded on ___.
impair;v. làm yếu đi. Eg: He was told that smoking would ___ his health.
impatient;adj. thiếu kiên nhẫn. Eg: Don’t be so ___ – it will soon be your turn.
imperative;n. có tính chất mệnh lệnh. Eg: In the sentence ‘Come here!’, ‘come’ is an ___ (verb).
imperial;adj. thuộc hoàng đế. Eg: the ___ crown.
impersonal;adj. vô cảm. Eg: His manner was formal and ___.
implement;n. dụng cụ. Eg: kitchen/garden ___s.
implicate;v. bị vướng vào. Eg: The minister resigned after being ___d in the scandal.
imply;v. ám chỉ. Eg: Are you ___ing that I am a liar?
impolite;adj. bất lịch sự. Eg: You must not be ___ to the teacher.
import;v. nhập khẩu. Eg: We ___ wine from France.
importance;n. tầm quan trọng. Eg: This is a matter of great ___.
impose;v. đánh thuế. Eg: The government have ___d a new tax on cigarettes.
impress;v. có ấn tượng. Eg: I was ___ed by his good manners.
impression;n. ấn tượng. Eg: The film made a great ___ on me.
improve;v. cải thiện. Eg: His work has greatly ___d
improvise;v. ứng biến. Eg: Jazz musicians pride themselves on their ability to ___.
impulse;n. sự hấp tấp. Eg: I bought the dress on ___ – I didn’t really need it
inadvertent;adj. vô tình. Eg: an ___ insult.
incentive;n. sự khuyến khích. Eg: Hope of promotion was an ___ to hard work.
incident;n. sự kiện. Eg: There was a strange ___ in the supermarket today.
incline;v. cúi đầu. Eg: He ___d his head toward me.
include;v. bao gồm. Eg: Am I ___d in the team?
inclusion;n. sự bao gồm. Eg: Phil’s ___ in the soccer team was a surprise.
inclusive;adj. kể cả. Eg: May 7 to May 9 ___ is three days.
income;n. thu nhập. Eg: He cannot support his family on his ___.
incorporate;v. bao gồm. Eg: The shopping centre ___s a library and a bank.
incorrect;adj. sai. Eg: an ___ assumption
increase;v. tăng lên. Eg: The number of children in this school has ___d greatly in recent years.
incredible;adj. khó tin. Eg: He does an ___ amount of work.
incredulous;adj. hoài nghi. Eg: She listened to him with an ___ expression on her face.
independence;n. sự độc lập. Eg: Panama declared its ___ in 1903.
independent;adj. độc lập. Eg: an ___ country
index;n. bản chú dẫn. Eg: Look it up in the ___.
indicate;v. chỉ ra. Eg: We can paint an arrow here to ___ the right path.
indifferent;adj. hờ hững. Eg: She is quite ___ to other people’s suffering.
indirect;adj. quanh co. Eg: We arrived late because we took rather an ___ route.
individual;adj. một mình, riêng lẻ. Eg: Put price labels on each ___ item.
induce;v. xui khiến. Eg: Nothing would ___ me to follow his advice again.
industrious;adj. siêng năng. Eg: ___ pupils.
industry;n. ngành công nghiệp. Eg: the ship-building ___
inevitable;adj. không thể tránh khỏi. Eg: The Prime Minister said that war was ___.
infamous;adj. có tiếng xấu. Eg: an ___ mafia boss.
infant;n. trẻ thơ. Eg: the baptism of ___s
infect;v. lây nhiễm. Eg: She had a bad cold last week and has ___ed the rest of the class.
infer;v. suy luận. Eg: I ___red from your silence that you were angry.
inferior;adj. kém hơn. Eg: The quality of this carpet is ___ to that one.
infinite;adj. vô tận. Eg: We believe that space is ___.
inflame;v. khích động. Eg: Her controversial views tend to ___ people’s tempers.
inflate;v. bơm phồng. Eg: He used a bicycle pump to ___ the ball.
influence;n. ảnh hưởng. Eg: He used his ___ to get her the job
inform;v. thông báo. Eg: Please ___ me of your intentions in this matter
informal;adj. thân mật. Eg: The two prime ministers will meet for ___ discussions today
informative;adj. có nhiều thông tin. Eg: an ___ book.
infrastructure;n. cơ sở hạ tầng. Eg: Investment in ___ is critical to economic growth.
ingenious;adj. khéo léo. Eg: He was ___ at making up new games for the children.
ingredient;n. thành phần. Eg: Could you give me a list of the ___s of the cake?
inhabit;v. sinh sống. Eg: Polar bears ___ the Arctic region
inhabitant;n. cư dân. Eg: the ___s of the village
inhale;v. hít vào. Eg: He ___d deeply
inherent;adj. vốn có. Eg: the dangers ___ in nuclear energy
inherit;v. thừa kế. Eg: He ___ed the house from his father
inhibit;v. cấm. Eg: Several factors may ___ a child’s educational development.
initial;adj. ban đầu. Eg: There were difficulties during the ___ stages of building the house.
injure;v. gây thương tích. Eg: He ___d his arm when he fell
injustice;n. sự không công bằng. Eg: He complained of ___ in the way he had been treated
inland;adj. nội địa. Eg: ___ areas.
inn;n. khách sạn nhỏ
innocence;n. sự vô tội. Eg: He at last managed to prove his ___
innocent;adj. vô tội. Eg: A man should be presumed ___ of a crime until he is proved guilty
innovation;n. đổi mới. Eg: The new system in the school canteen was a welcome ___.
input;n. đầu vào
inquire;v. hỏi thăm. Eg: He ___d the way to the art gallery
inseparable;adj. không thể chia rẽ. Eg: The two women were ___ companions.
insert;v. chèn vào. Eg: He ___ed the money in the parking meter
inside;n. bên trong. Eg: The ___ of this apple is quite rotten.
insight;n. sự thấu hiểu. Eg: He shows remarkable ___ (into children’s problems).
insist;v. khăng khăng. Eg: He ___s that I was to blame for the accident
insomnia;n. bệnh mất ngủ. Eg: She takes sleeping-pills as she suffers from ___.
inspect;v. kiểm tra. Eg: The detective ___ed the bloodstains on the carpet.
inspire;v. truyền cảm hứng. Eg: The players were ___d by the loyalty of their supporters and played better football than ever before.
instance;n. ví dụ. Eg: As a social worker, he saw many ___s of extreme poverty.
instant;adj. ngay lập tức. Eg: Anyone disobeying these rules will face ___ dismissal
instead;adv. thay vì. Eg: I don’t like coffee. Could I please have tea ___?
institute;n. Viện Nghiên cứu. Eg: There is a lecture at the Philosophical Institute tonight.
institution;n. thể chế. Eg: schools, hospitals, prisons and other ___s.
instruct;v. dạy. Eg: Girls as well as boys should be ___ed in woodwork.
instrument;n. dụng cụ. Eg: medical/surgical/mathematical ___s.
insulate;v. cách ly. Eg: Rubber and plastic are used for insulating electric wires and cables.
insult;v. xúc phạm. Eg: He ___ed her by telling her she was not only ugly but stupid too.
intact;adj. nguyên vẹn. Eg: The box was washed up on the beach with its contents still ___.
intake;n. vật, lượng lấy vào. Eg: This year’s ___ of students is smaller than last year’s.
integrate;v. hội nhập. Eg: Some immigrants do not find it easy to ___ into a new culture.
integrity;n. trung thực. Eg: He is a man of absolute ___.
intellect;n. trí tuệ. Eg: He was a person of great ___.
intellectual;adj. thuộc trí tuệ. Eg: He does not do any sports – his interests are mainly ___.
intelligence;n. trí thông minh. Eg: It requires a high degree of ___ to do this job well.
intelligent;adj. sáng dạ. Eg: an ___ child
intend;v. định. Eg: Do you still ___ to go?
intense;adj. cực kỳ. Eg: ___ heat
intent;adj. mải mê. Eg: He’s ___ on going
intention;n. ý định. Eg: He has no ___ of leaving
interact;v. tương tác. Eg: Antibiotics can sometimes ___ with other medicines.
internal;adj. nội tạng. Eg: The man suffered ___ injuries in the accident.
international;adj. quốc tế. Eg: ___ trade
interpret;v. phiên dịch. Eg: He spoke to the audience in French and she ___ed.
interval;n. khoảng thời gian giữa 2 sự kiện. Eg: He returned home after an ___ of two hours.
intervene;v. can thiệp. Eg: He ___d in the dispute.
intimate;adj. thân thiết. Eg: ___ friends.
intimidate;v. đe dọa. Eg: I was ___d by the doorman’s aggressive attitude.
intrigue;n. mánh khóe. Eg: He became president as a result of (a) political ___.
intuitive;adj. thuộc về trực giác. Eg: an ___ understanding.
invade;v. xâm phạm. Eg: Britain was twice ___d by the Romans.
invalid;adj. vô hiệu. Eg: Your passport is out of date and therefore ___.
invasion;n. sự xâm phạm. Eg: a military ___.
invent;v. phát minh. Eg: Who ___ed the microscope?
inventive;adj. sáng tạo. Eg: an ___ mind.
inventory;n. bản kiểm kê. Eg: We’ll have to check everything against the ___.
invest;v. đầu tư. Eg: He ___ed (20,000 dollars) in a building firm.
investigate;v. điều tra. Eg: The police are investigating the crime
invite;v. mời. Eg: They have ___d us to dinner tomorrow.
invoke;v. cầu khẩn. Eg: He ___d a little-known federal law.
involve;v. đòi hỏi, cần phải. Eg: His job ___s a lot of travelling.
inward;adj. ở trong. Eg: his ___ thoughts.
iron;n. sắt. Eg: Steel is made from ___
irrigate;v. tưới. Eg: Drainage pipes are used to ___ the crops.
irritable;adj. bực tức. Eg: He was in an ___ mood.
irritate;v. chọc giận. Eg: The children’s chatter ___d him.
island;n. hòn đảo. Eg: a tropical ___
isolate;v. cô lập. Eg: Several houses have been ___d by the flood water
issue;v. phát hành. Eg: The police ___d a description of the criminal
itch;n. sự ngứa. Eg: He had an ___ in the middle of his back and could not scratch it easily.
item;n. khoản, món. Eg: He ticked the ___s as he read through the list.
ivory;n. ngà voi. Eg: Ivory was formerly used to make piano keys
jacket;n. áo vét. Eg: He wore brown trousers and a blue ___.
jagged;adj. lởm chởm. Eg: a ___ piece of broken glass
jail;n. tù. Eg: You ought to be sent to ___ for doing that.
janitor;n. người trông nhà. Eg: He works as a school ___.
jaw;n. quai hàm. Eg: the upper/lower ___
jealous;adj. ghen tị. Eg: She is ___ of her sister.
jealousy;n. sự nghen tuông. Eg: feelings of intense ___.
jeans;noun plural. quần bò. Eg: She was wearing a pair of faded ___.
jellyfish;n. con sứa. Eg: She was stung by a ___.
jet;n. hạt huyền. Eg: The beads are made of ___
jewel;n. đá quý. Eg: rubies, emeralds, and other ___s.
job;n. việc làm. Eg: She has a ___ as a bank clerk
jog;v. chạy bộ. Eg: She ___s / goes ___ging round the park for half an hour every morning.
joint;n. chỗ nối. Eg: The plumber tightened up all the ___s in the pipes.
journal;n. tạp chí. Eg: the British Medical Journal.
journalism;n. nghề báo chí. Eg: investigative ___.
journalist;n. nhà báo. Eg: She is a freelance ___ who works for publications nationwide.
journey;n. quãng đường. Eg: By train, it is a two-hour ___ from here to the coast
joy;n. hạnh phúc. Eg: The children jumped for ___ when they saw the new toys.
judge;v. xét xử. Eg: Who will be judging this case?
jungle;n. rừng nhiệt đới. Eg: the Amazon ___
junior;n. thấp hơn. Eg: He is two years my ___
jurisdiction;n. công lý. Eg: The court had no ___ to release the prisoner.
jury;n. Bồi thẩm đoàn. Eg: The verdict of the ___ was that the prisoner was guilty of the crime.
justice;n. sự công bằng. Eg: Everyone has a right to ___
justify;v. bào chữa. Eg: How can the government ___ the spending of millions of pounds on weapons when there is so much poverty in the country?
justly;adv. một cách công bằng. Eg: He was ___ blamed for the accident.
keen;adj. hăng hái nhiệt tình. Eg: He is a ___ golfer
keep;v. gìn giữ. Eg: He gave me the picture to ___.
kerosene;n. dầu lửa. Eg: The jet plane refuelled with ___
kettle;n. ấm đun nước. Eg: The ___ is boiling.
key;n. chìa khóa. Eg: Have you got the ___ for this door?
keyboard;n. bàn phím. Eg: The pianist sat down at the ___ and began to play
kid;n. trẻ em. Eg: They’ve got three ___s now, two boys and a girl
kidnap;v. bắt cóc. Eg: He is very wealthy and lives in fear of his children being ___ped.
kidney;n. thận. Eg: The ___s of some animals are used as food
kill;v. giết. Eg: He ___ed the rats with poison
kin;noun plural. dòng họ
kit;quân trang. Eg: He carried his tennis ___ in a bag
knee;n. đầu gối. Eg: He fell and cut his ___
kneel;v. quỳ xuống. Eg: She knelt (down) to fasten the child’s shoes
knight;n. hiệp sỹ. Eg: King Arthur and his ___s.
knowledge;n. sự hiểu biết. Eg: She was greatly encouraged by the ___ that she had won first prize in the competition.
knuckle;n. khớp đốt tay. Eg: She hit her hand against the wall and grazed her ___s.
label;n. nhãn mác. Eg: luggage ___s
laboratory;n. phòng thí nghiệm. Eg: Samples of her blood were sent to the hospital lab(oratory) for testing.
lack;v. thiếu. Eg: He ___ed the courage to ask her out on a date.
ladder;n. cái thang. Eg: She was standing on a ___, painting the ceiling
lag;v. tụt lại sau. Eg: We waited for the smaller children, who were ___ging behind the rest.
lame;adj. khập khiễng. Eg: He was ___ for weeks after his fall.
landing;n. cập bến, hạ cánh. Eg: an emergency ___
landlord;n. chủ nhà. Eg: My landlady has just put up my rent.
landmark;n. mốc. Eg: The church tower is a ___ for sailors because it stands on the top of a cliff.
landscape;n. phong cảnh. Eg: He stood on the hill surveying the ___.
language;n. ngôn ngữ. Eg: the development of ___ in children.
large;adj. rộng, lớn. Eg: a ___ number of people
latitude;n. vĩ độ. Eg: What is the ___ of London?
latter;adj. sau cùng. Eg: The ___ part of our holiday was spent mainly on the beach.
laugh;v. cười. Eg: We ___ed at the funny photographs
laughter;n. tiếng cười. Eg: We could hear ___ / the sound of ___ from the next room.
launch;v. hạ thuỷ, phóng. Eg: As soon as the alarm was sounded, the lifeboat was ___ed
laundry;n. cửa hàng giặt lả. Eg: She took the sheets to the ___
lava;n. dung nham
law;n. pháp luật. Eg: Breaking the speed limit is against the ___
lawn;n. bãi cỏ. Eg: He is mowing the ___.
lawyer;n. luật sư. Eg: If you want to make your will, consult a ___.
lay;v. đặt, để. Eg: She laid the clothes in a drawer / on a chair
layer;n. lớp. Eg: The ground was covered with a ___ of snow
lead;v. dẫn đường, hướng dẫn. Eg: Follow my car and I’ll ___ you to the motorway
lean;v. cúi. Eg: The lamp-post was ___ing to one side.
leap;v. nhảy. Eg: He ___t into the boat.
lease;n. sự cho thuê nhà đất. Eg: We signed the ___ yesterday
leash;n. dây buộc chó. Eg: Terry let the dog off the ___.
leather;n. da. Eg: These shoes are made of ___
leave;v. bỏ đi. Eg: He left the room for a moment
lecture;n. bài giảng. Eg: a history ___.
leg;n. chân. Eg: The horse injured a front ___
legacy;n. tài sản thừa kế. Eg: He was left a ___ by his great aunt.
legal;adj. thuộc pháp luật. Eg: Is it ___ to bring gold into the country?
legend;n. huyền thoại. Eg: the ___ of St George.
legislate;v. lập pháp. Eg: The government plan to ___ against the import of foreign cars.
legislature;n. cơ quan lập pháp
legitimate;adj. hợp pháp. Eg: Is this procedure perfectly ___?
lend;v. cho mượn. Eg: She had forgotten her umbrella so I lent her mine to go home with.
length;n. chiều dài. Eg: What is the ___ of your garden?
lentil;n. cây đậu lãng. Eg: (also adjective) ___ soup.
level;n. mức. Eg: The ___ of the river rose
liable;adj. phải chịu cái gì. Eg: This road is ___ to flooding
liberty;n. sự giải phóng. Eg: He ordered that all prisoners should be given their ___.
library;n. thư viện. Eg: He works in the public ___
license;v. cấp phép. Eg: The restaurant is ___d to serve alcohol.
lick;v. liếm. Eg: The dog ___ed her hand.
lie;n. lời nói dối. Eg: It would be a ___ to say I knew, because I didn’t.
lieutenant;n. trung úy
life;n. sự sống. Eg: Doctors are fighting to save the child’s ___.
lift;v. nâng lên. Eg: The box was so heavy that I couldn’t ___ it.
light;n. ánh sáng. Eg: It was nearly dawn and the ___ was getting stronger
lightly;adv. một cách nhẹ nhàng. Eg: She tapped him ___ on the shoulder.
lightning;n. chớp. Eg: The house was struck by ___.
likewise;adv. tương tự. Eg: He ignored her, and she ignored him ___.
lily;n. hoa loa kèn
limb;n. chi. Eg: an artificial ___
limit;n. ranh giới. Eg: There was no ___ to his ambition.
limp;adj. mềm, ủ rũ. Eg: a ___ lettuce.
line;n. dây. Eg: She hung the washing on the ___
linger;v. vẫn còn lưu lại. Eg: The smell of fish ___ed in the kitchen for days.
linguistic;adj. thuộc về ngôn ngữ. Eg: ___ competence.
link;n. mắt xích. Eg: There was a worn ___ in the chain and it broke
lion;n. sư tử
lip;n. môi. Eg: She bit her ___.
liquid;adj. lỏng. Eg: ___ nitrogen
list;n. danh sách. Eg: a shopping ___
listen;v. lắng nghe. Eg: I told her three times, but she wasn’t ___ing
literary;adj. văn học. Eg: a ___ magazine.
literature;n. văn học. Eg: modern ___.
lively;adj. rất, sống động. Eg: She took a ___ interest in us
liver;n. gan. Eg: a ___ transplant.
lizard;n. con thằn lằn
load;n. vật chở. Eg: The lorry/truck had to stop because its ___ had fallen off
loaf;n. ổ bánh. Eg: a sliced ___.
loan;n. tiền cho vay. Eg: I shall ask the bank for a ___.
lobster;n. tôm hùm
local;adj. địa phương. Eg: The ___ shops are very good
locate;v. nằm ở. Eg: The kitchen is ___d in the basement.
lodge;n. nhà thường trực. Eg: the porter’s ___.
log;n. khúc củi. Eg: The trees were sawn into ___s and taken to the sawmill.
lone;adj. không bầu bạn, đơn chiếc. Eg: a ___ figure on the beach.
loneliness;n. sự cô đơn. Eg: Many old people suffer from ___.
longevity;n. tuổi thọ. Eg: Increased ___ is one of the modern world’s greatest achievements.
longing;n. sự khao khát. Eg: She looked at the cakes with ___.
loop;n. vòng, nút. Eg: She made a ___ in the string.
loose;adj. lỏng, chùng. Eg: a ___ coat
lose;v. mất. Eg: She has lost interest in her work
loss;n. sự mất mát. Eg: She was suffering from ___ of memory
lotus;n. hoa sen
loud;adj. to, ầm ĩ. Eg: a ___ voice
love;n. yêu thích. Eg: She has a great ___ of music
low;adj. thấp. Eg: ___ hills
lower;v. hạ thấp. Eg: She ___ed her voice.
loyal;adj. trung thành. Eg: a ___ friend.
lump;n. tảng, miếng. Eg: The custard was full of ___s and no-one would eat it.
lunar;adj. mặt trăng. Eg: a ___ eclipse.
lung;n. phổi. Eg: ___ disease.
lure;n. vẻ quyến rũ. Eg: The ___ of his mother’s good cooking brought him back home.
lush;adj. tươi tốt. Eg: ___ meadows.
luxury;n. xa xỉ. Eg: They live in ___
lyric;adj. trữ tình. Eg: The tune is good, but I don’t like the ___s.
magazine;n. tạp chí. Eg: women’s ___s
magic;n. ma thuật. Eg: The prince was turned by ___ into a frog.
magical;adj. thuộc ảo thuật. Eg: The wizard possesses ___ powers.
magnet;n. nam châm. Eg: A compass uses a ___ to show which way is north.
magnificent;adj. lộng lẫy. Eg: a ___ costume
magnify;v. phóng to, thổi phồng. Eg: A telescope is a device used to ___ distant objects
magnitude;n. tầm quan trọng. Eg: a decision of enormous ___.
male;n. đàn ông, đực, trống. Eg: the ___ of the species
mammal;n. động vật có vú. Eg: Monkeys are ___s.
manage;v. quản lý. Eg: My lawyer ___s all my legal affairs/money.
management;n. việc quản lý. Eg: an old-fashioned style of ___
managerial;adj. thuộc cấp quản lý. Eg: a ___ decision/position/responsibility.
mandarin;n. quả quít
manifest;v. biểu lộ. Eg: The illness can ___ itself in various different ways.
manipulate;v. điều khiển khéo léo. Eg: I watched him manipulating the controls of the aircraft.
mansion;n. lâu đài. Eg: They own a country ___.
manufacture;v. sản xuất. Eg: This firm ___s cars at the rate of two hundred per day.
many;adj. nhiều, lắm. Eg: Many languages are spoken in Africa
marble;n. đá hoa. Eg: This table is made of ___
march;v. hành quân. Eg: Soldiers were ___ing along the street.
marine;adj. thuộc biển. Eg: ___ animals
mariner;n. thủy thủ. Eg: a master ___.
mark;n. đồng Mác (Đức). Eg: She got good ___s in the exam.
market;n. chợ. Eg: He has a clothes stall in the ___.
marshal;n. người phụ trách nghi lễ. Eg: Give me a minute to ___ my thoughts.
martial;adj. hiếu chiến. Eg: a ___ nation.
marvel;n. điều kỳ diệu. Eg: The Great Wall of China is one of the ___s of the world
masculine;adj. thuộc giống đực. Eg: ___ qualities.
massive;adj. đồ sộ, to lớn. Eg: a ___ building
mast;n. cột buồm, cột ăng-ten. Eg: The sailor climbed the ___.
master;n. chủ nhân. Eg: I’m ___ in this house!
masterpiece;n. kiệt tác
match;n. diêm. Eg: He struck a ___.
material;n. nguyên vật liệu. Eg: Tables are usually made from solid ___ such as wood.
mature;adj. chín chắn. Eg: a very ___ person
maximize;v. tăng tối đa. Eg: We’re trying to ___ our profits.
maximum;adj. tối đa. Eg: This requires ___ effort / the ___ amount of effort.
maybe;adv. có thể. Eg: Maybe he’ll come, and ___ he won’t.
mayor;n. thị trưởng
meal;n. bữa ăn. Eg: a three-course ___
meantime;adv. trong lúc ấy. Eg: I’ll hear her account of the matter later – ___, I’d like to hear yours.
meanwhile;adv. trong lúc đó. Eg: The child had gone home. Meanwhile, his mother was searching for him in the street.
measure;n. dụng cụ đo lường. Eg: a glass ___ for liquids
meat;n. thịt. Eg: She does not eat ___
mechanic;n. thợ máy. Eg: a garage ___.
mechanism;n. cơ cấu. Eg: a watch ___.
media;n. phương tiện truyền thông đại chúng. Eg: the news ___
medical;adj. thuộc y học. Eg: ___ care
medication;n. cấp thuốc. Eg: He has to take ___ for a heart condition.
medicine;n. thuốc. Eg: a dose of ___.
medieval;adj. thời trung cổ. Eg: ___ music.
meditate;v. trầm tư. Eg: He was meditating on his troubles.
meet;v. gặp gỡ. Eg: She met a man on the train.
meeting;n. sự gặp nhau. Eg: The ___ between my mother and my husband was not friendly.
melody;n. giai điệu. Eg: He played Irish melodies on the harp.
member;n. thành viên. Eg: The association has three thousand ___s.
memorable;adj. đáng nhớ. Eg: a ___ event.
memory;n. trí nhớ. Eg: He has a good ___ for details.
mend;v. sửa chữa. Eg: Can you ___ this broken chair?
mental;adj. thuộc tâm thần. Eg: ___ illnesses/disorders.
mention;v. đề cập. Eg: He ___ed the plan.
merchandise;n. hàng hóa. Eg: This store sells ___ from all over the world.
merchant;n. thương gia. Eg: a timber/tea/wine ___.
mercy;n. lòng nhân từ. Eg: He showed his enemies no ___.
mere;adj. chỉ là. Eg: a ___ child
merge;v. hoà vào. Eg: The sea and sky appear to ___ at the horizon.
merit;n. giá trị. Eg: He reached his present position through ___.
merry;adj. vui vẻ. Eg: ___ children
mess;n. tình trạng hỗn độn. Eg: This room is in a terrible ___!
message;n. tin tức. Eg: I have a ___ for you from Mr Johnston.
messenger;n. người đưa tin, sứ giả. Eg: The king’s ___ brought news of the army’s defeat.
metabolic;adj. thuộc trao đổi chất. Eg: ___ rate.
metabolism;n. sự trao đổi chất. Eg: Exercise speeds up the body’s ___.
metal;n. kim loại. Eg: Gold, silver and iron are all ___s.
meteorological;adj. thuộc khí tượng học. Eg: a ___ chart.
meteorology;n. khí tượng học
