prescription;n. đơn thuốc. Eg: He gave me a ___ to give to the chemist.
presence;n. sự có mặt. Eg: The committee requests your ___ at Thursday’s meeting.
presently;adv. nhanh thôi. Eg: He will be here ___.
preserve;v. bảo vệ. Eg: (May) Heaven ___ us from danger!
pressure;n. lực, áp suất. Eg: Apply ___ to the cut in order to stop it bleeding
prestige;n. uy tín. Eg: Students are attracted to Harvard by its ___.
presume;v. cho là, đoán là. Eg: When I found the room empty, I ___d that you had gone home
pretend;v. giả vờ, làm ra vẻ. Eg: Let’s ___ that this room is a cave!
prevail;v. chiếm ưu thế. Eg: With God’s help we shall ___ over sin and wickedness
prevalent;adj. phổ biến. Eg: Lung diseases used to be ___ among miners.
prevent;v. ngăn chặn. Eg: He ___ed me from going.
preview;n. cuộc duyệt trước. Eg: a sneak ___ of the film.
previous;adj. trước. Eg: We had met on a ___ occasion
price;n. giá cả. Eg: The ___ of the book was $10.
pride;n. sự tự hào. Eg: She looked with ___ at her handsome sons.
priest;n. linh mục. Eg: a Catholic ___.
primary;adj. chủ yếu, hàng đầu. Eg: His ___ concern is his family.
primate;n. tổng giám mục
prime;adj. chủ yếu, hàng đầu. Eg: the ___ minister
primitive;adj. nguyên thuỷ. Eg: ___ stone tools.
prince;n. hoàng tử. Eg: Prince Charles.
principal;adj. chính. Eg: Shipbuilding was one of Britain’s ___ industries.
principle;n. nguyên lý. Eg: the ___ of gravity.
print;n. dấu vết. Eg: a foot___
prior;adj. trước. Eg: a ___ engagement.
priority;n. quyền ưu tiên. Eg: An ambulance must have ___ over other traffic.
prism;n. lăng trụ
prisoner;n. tù nhân. Eg: The ___s escaped from jail.
privacy;n. sự riêng tư, đời tư. Eg: in the ___ of your own home.
private;adj. riêng tư. Eg: The headmaster lives in a ___ apartment in the school
privilege;n. đặc quyền. Eg: Senior students are usually allowed certain ___s.
prize;n. giải thưởng. Eg: He was awarded a lot of ___s at school.
probably;adv. có khả năng. Eg: I’ll ___ telephone you this evening.
probe;n. cái que thăm. Eg: a police ___ into illegal activities.
problem;n. vấn đề khó khăn. Eg: Life is full of ___s
proceed;v. tiếp tục. Eg: They ___ed along the road
process;n. quá trình. Eg: We are using a new ___ to make glass.
proclaim;v. công bố. Eg: He was ___ed the winner.
prod;v. đâm, chọc. Eg: He ___ded her arm with his finger.
produce;v. đưa ra. Eg: She ___d a letter from her pocket.
product;n. kết quả. Eg: The plan was the ___ of hours of thought.
profession;n. nghề nghiệp. Eg: ‘What is your ___?’ ‘I’m a lawyer.’
professional;adj. thuộc về nghề. Eg: ___ skill.
professor;n. giáo sư. Eg: He is a ___ of English at Leeds
proficient;adj. thành thạo. Eg: a ___ swimmer.
profile;n. nét mặt nhìn nghiêng. Eg: She has a beautiful ___.
profit;n. lợi nhuận. Eg: I made a ___ of $8,000 on my house
profound;adj. sâu. Eg: ___ sleep.
progress;n. sự phát triển. Eg: the ___ of civilization.
prohibit;v. cấm. Eg: Smoking is ___ed.
project;n. dự án. Eg: a building ___.
prolong;v. kéo dài. Eg: Please do not ___ the discussion unnecessarily.
prominent;adj. nhô lên. Eg: ___ front teeth.
promote;v. thăng chức. Eg: He was ___d to head teacher.
prompt;adj. nhanh chóng. Eg: a ___ reply
pronounce;v. phát âm. Eg: He ___d my name wrongly
proof;n. chứng cớ. Eg: We still have no ___ that he is innocent.
propel;v. đẩy đi. Eg: The boat is ___led by a diesel engine.
proper;adj. đúng, thích hợp. Eg: That isn’t the ___ way to clean the windows
prophecy;n. sự tiên tri. Eg: He made many prophecies about the future.
proportion;n. phần. Eg: Only a small ___ of the class passed the exam.
propose;v. đề nghị. Eg: I ___d my friend for the post
propulsion;n. sự đẩy đi. Eg: jet ___.
prosecute;v. truy tố. Eg: He was ___d for theft.
prospect;n. triển vọng. Eg: He didn’t like the ___ of going abroad
prosper;v. thịnh vượng. Eg: His business is ___ing.
protect;v. bảo vệ. Eg: She ___ed the children from every danger
protein;n. chất đạm protein
protocol;n. nghi thức ngoại giao. Eg: Diplomatic ___ must be observed at all times.
proud;adj. tự hào. Eg: He was ___ of his new house
prove;v. chứng minh. Eg: This fact ___s his guilt
provide;v. cung cấp. Eg: He ___d the wine for the meal
province;n. tỉnh. Eg: Britain was once a Roman ___.
provision;n. sự cung cấp. Eg: The government are responsible for the ___ of education for all children.
provoke;v. chọc tức, khiêu khích. Eg: Are you trying to ___ me?
proximity;n. ở gần. Eg: Their house is in close ___ to ours.
psychiatric;adj. thuộc tâm thần học. Eg: a ___ ward.
psychiatry;n. tâm thần học
psychic;adj. thuộc tâm linh, tâm thần. Eg: She claims to possess ___ powers.
psychology;n. tâm lý học. Eg: She suffers from various psychological problems.
psychotic;adj. rối loạn tâm thần. Eg: a ___ patient.
public;adj. công khai, công luận, công cộng. Eg: a ___ library
publication;n. sự công bố, sự xuất bản sách. Eg: the ___ of a new novel
publicity;n. sự quảng cáo. Eg: There is a lot of ___ about the dangers of smoking.
publicize;v. đưa ra công khai. Eg: We are publicizing a new product.
publish;v. xuất bản. Eg: His new novel is being ___ed this month.
puddle;n. vũng nước. Eg: It had been raining, and there were ___s in the road.
puff;n. luồng gió thổi. Eg: A ___ of wind moved the branches.
pull;v. kéo. Eg: He ___ed the chair towards the fire
pumpkin;n. bí ngô
punctual;adj. đúng giờ. Eg: Please be ___ for your appointment
punish;v. trừng phạt. Eg: He was ___ed for stealing the money.
punishment;n. sự trừng phạt. Eg: He was sent to prison for two years as (a) ___.
pup;n. chó con. Eg: a sheepdog ___(py).
pure;n. bột nhuyễn. Eg: tomato purée.
purple;n. màu đỏ tía
purpose;n. mục đích. Eg: What is the ___ of your visit?
purse;n. cái ví. Eg: I looked in my ___ for some change.
pursue;v. đuổi, truy bắt. Eg: They ___d the thief through the town.
pursuit;n. hành động đuổi theo. Eg: The thief ran down the street with a policeman in (hot) ___.
puzzle;v. làm bối rối. Eg: The question ___d them
pyramid;n. hình chóp
qualify;v. đủ tiêu chuẩn. Eg: A degree in English does not necessarily ___ you to teach the subject
quality;n. chất lượng. Eg: We produce several different qualities of paper
quantity;n. số lượng. Eg: What ___ of paper do you need?
quantum;n. lượng tử. Eg: The amount of energy given off is measured in quanta.
quarrel;n. sự cãi nhau. Eg: I’ve had a ___ with my girlfriend.
quarter;n. một phần tư. Eg: There are four of us, so we’ll cut the cake into ___s
quiet;adj. yên lặng. Eg: Tell the children to be ___
quit;v. bỏ, ngừng. Eg: I’m going to ___ teaching
quite;adv. hoàn toàn. Eg: This is ___ impossible.
quote;v. trích dẫn. Eg: to ___ Shakespeare / Shakespeare’s words / from Shakespeare, ‘Is this a dagger which I see before me?’
rabbit;n. con thỏ. Eg: a pet ___.
race;n. cuộc đua. Eg: a horse ___.
racial;adj. thuộc sắc tộc. Eg: ___ characteristics
rack;n. giá, gác. Eg: Put these tools back in the ___
radiate;v. tỏa, chiếu. Eg: A fire ___s heat.
radical;adj. cơ bản. Eg: ___ faults in the design.
radioactive;adj. tia phóng xạ. Eg: ___ metals.
raft;n. bè gỗ
rag;n. giẻ rách. Eg: I’ll polish my bike with this old ___.
rage;n. cơn thịnh nộ. Eg: He flew into a ___
raid;n. cuộc đột kích. Eg: The enemy made a ___ on the docks
rail;n. tay vịn. Eg: Don’t lean over the ___
raincoat;n. áo mưa
rainforest;n. rừng mưa nhiệt đới
raisin;n. nho khô. Eg: She put ___s and sultanas in the cake.
rally;v. tập hợp lại. Eg: The general tried to ___ his troops after the defeat
ranch;n. nông trại. Eg: a cattle ___.
random;adj. ngẫu nhiên. Eg: The opinion poll was based on a ___ sample of adults.
range;n. loại. Eg: a wide ___ of books for sale
ranger;n. người bảo vệ rừng, bảo vệ công viên. Eg: a park ___.
rank;n. cấp bậc. Eg: He was promoted to the ___ of sergeant/colonel.
ransom;n. tiền chuộc. Eg: They paid a ___ of $40,000
rapid;adj. nhanh. Eg: He made some ___ calculations
rapidly;adv. một cách nhanh chóng
rate;n. tỷ lệ. Eg: a high (monthly) accident ___ in a factory.
real;adj. thực sự. Eg: They say that there’s a ___ monster in that cave.
realistic;adj. hiện thực. Eg: a ___ painting.
realize;v. nhận ra. Eg: I ___ that I can’t have everything I want
realm;n. vương quốc. Eg: She’s well-known in the ___ of sport.
reason;n. lý do. Eg: What is the ___ for this noise?
rebel;n. kẻ nổi loạn. Eg: The ___s killed many soldiers
recall;v. gọi lại. Eg: He had been ___ed to his former post.
receipt;n. sự nhận được. Eg: Please sign this form to acknowledge ___ of the money.
receive;v. nhận được. Eg: He ___d a letter
recent;adj. gần đây. Eg: Things have changed in ___ weeks
recipe;n. công thức. Eg: a ___ for curry
recipient;n. người nhận. Eg: the ___ of a letter.
reckless;adj. thiếu thận trọng. Eg: a ___ driver
recognition;n. sự công nhận, sự nhận ra. Eg: They gave the boy a medal in ___ of his courage
recognize;v. nhìn thấy, nghe thấy. Eg: I ___d his voice/handwriting
recommend;v. khuyên. Eg: The doctor ___ed a long holiday.
reconcile;v. giải hòa. Eg: Why won’t you be ___d (with him)?
recruit;n. lính mới. Eg: a new ___.
rectangle;n. hình chữ nhật
recur;v. tái diễn. Eg: This problem keeps ___ring.
recycle;v. tái chế. Eg: I try to ___ as much household rubbish as possible.
red;n. màu đỏ. Eg: a ___ car/dress / cheeks
reduce;v. giảm. Eg: The shop ___d its prices
reef;n. đá ngầm. Eg: The ship got stuck on a ___.
refer;v. nhắc tới. Eg: He doesn’t like anyone ___ring to his wooden leg
referee;n. trọng tài. Eg: The ___ sent two of the players off the field.
reference;n. sự tham khảo. Eg: He made several ___s to her latest book
refine;v. ltinh chế. Eg: Oil is ___d before it is used.
reflect;v. phản xạ. Eg: The white sand ___ed the sun’s heat.
reflection;n. phản xạ, phản chiếu. Eg: She looked at her ___ in the water
reflex;n. sự phản xạ, sự phản ánh. Eg: The doctor tapped the patient’s knee in order to test his ___es
refrain;n. điệp khúc. Eg: You are asked to ___ from smoking / from (drinking) alcohol.
refrigerate;v. làm lạnh. Eg: Meat should be ___d.
refrigerator;n. tủ lạnh. Eg: Milk should be kept in the ___.
refuge;n. nơi ẩn náu. Eg: The escaped prisoner sought ___ in the church.
refund;v. trả lại. Eg: When the concert was cancelled, the people who had bought tickets had their money ___ed.
refuse;v. từ chối. Eg: He ___d to help me
refute;v. bác bẻ. Eg: You can easily ___ his argument.
regard;v. coi như. Eg: I ___ his conduct as totally unacceptable.
regime;n. chế độ. Eg: a Communist ___.
region;n. vùng. Eg: Do you know this ___ well?
register;n. danh sách. Eg: a school attendance ___
regret;v. tiếc. Eg: I ___ my foolish behaviour/behavior
regular;adj. thường xuyên. Eg: Saturday is his ___ day for shopping
regulate;v. kiểm soát. Eg: We must ___ our spending
rehearse;v. luyện. Eg: You must ___ the scene again.
reign;n. triều đại. Eg: in the ___ of Queen Victoria.
reindeer;n. tuần lộc
reinforce;v. tăng cường. Eg: I’ve ___d the elbows of this jacket with leather patches
reject;v. từ chối. Eg: She ___ed his offer of help
relate;v. thuật lại. Eg: He ___d all that had happened to him.
relationship;n. mối quan hệ. Eg: He finds it very difficult to form lasting ___s.
relative;n. họ hàng. Eg: All his ___s attended the funeral.
relax;v. thư giãn. Eg: The doctor gave him a drug to make him ___
release;v. thả, giải thoát. Eg: He was ___d from prison yesterday
relevant;adj. liên quan. Eg: I don’t think his remarks are ___ (to our discussion)
relief;n. sự giảm nhẹ, sự khuây khỏa. Eg: When you have a headache, an aspirin can bring ___
religion;n. sự sùng bái. Eg: Christianity and Islam are two different ___s.
religious;adj. thuộc tôn giáo. Eg: ___ education
reluctant;adj. miễn cưỡng. Eg: He was ___ to accept the medal for his bravery.
remain;v. còn lại. Eg: Only two tins of soup ___
remainder;n. người/vật còn lại. Eg: I’ve corrected most of the essays – the ___ will get done tomorrow.
remark;n. nhận xét. Eg: The chairman made a few ___s, then introduced the speaker.
remedy;n. phương thuốc, giải pháp. Eg: I know a good ___ for toothache.
remind;v. nhắc nhở. Eg: Remind me to post that letter
remorse;n. sự ăn năn. Eg: She was filled with ___.
remote;adj. xa. Eg: a ___ village in New South Wales
remove;v. di chuyển, dọn, cách chức. Eg: Will someone please ___ all this rubbish!
renaissance;n. Thời kỳ Phục hưng. Eg: (also adjective) Renaissance architecture/art.
render;v. làm cho. Eg: His remarks ___ed me speechless.
renovate;v. phục hồi. Eg: He ___s old houses and sells them at a profit.
renown;n. danh tiếng. Eg: a musician of world-class ___.
rent;n. tiền thuê nhà. Eg: The ___ for this flat is £250 a week.
repair;v. sửa. Eg: She’s ___ing a broken lock / torn jacket.
repay;v. trả lại. Eg: When are you going to ___ the money you borrowed?
repetitive;adj. mang tính lặp đi lặp lại. Eg: His speeches are very ___
replace;v. thay thế. Eg: I must ___ that broken lock
replenish;v. được bổ xung. Eg: We must ___ our stock of coal.
report;n. báo cáo. Eg: a child’s school ___
represent;v. đại diện. Eg: You have been chosen to ___ our association at the conference.
reproduce;v. tái tạo. Eg: Good as the film is, it fails to ___ the atmosphere of the book
reproductive;adj. có thể tái tạo. Eg: the ___ organs of a rabbit.
reptile;n. loài bò sát
reputable;adj. có danh tiếng. Eg: Is that a ___ firm?
require;v. cần đến. Eg: Is there anything else you ___?
rescue;v. cứu nguy. Eg: The lifeboat was sent out to ___ the sailors from the sinking ship.
research;n. cuộc nghiên cứu. Eg: He is engaged in cancer ___
resemble;v. giống với. Eg: He doesn’t ___ either of his parents.
resent;v. bực tức. Eg: I ___ his interference in my affairs.
reserve;v. đặt trước. Eg: The restaurant is busy on Saturdays, so I’ll phone up today and ___ a table.
resign;v. từ chức. Eg: If he criticizes my work again, I’ll ___
resist;v. chống lại. Eg: The soldiers ___ed the enemy attack
resolution;n. quyết tâm. Eg: He made a ___ to get up early.
resolve;v. kiên quyết. Eg: I’ve ___d to stop smoking.
resort;v. phải sử dụng đến. Eg: He couldn’t persuade people to do what he wanted, so he ___ed to threats of violence.
resource;n. sự giúp đỡ. Eg: We have used up all our ___s
resourceful;adj. tháo vát. Eg: a ___ person.
respective;adj. tương ứng. Eg: Peter and George went to their ___ homes.
respond;v. trả lời. Eg: He didn’t ___ to my question
response;n. sự trả lời, sự phản ứng. Eg: Our letters have never met with any ___
responsibility;n. trách nhiệm. Eg: He takes his responsibilities very seriously.
responsible;adj. có trách nhiệm. Eg: We’ll make one person ___ for buying the food for the trip.
rest;n. sự nghỉ ngơi. Eg: Digging the garden is hard work – let’s stop for a ___
restaurant;n. nhà hàng. Eg: a Greek ___.
restore;v. khôi phục. Eg: The church is going to be ___d.
restrain;v. kiềm chế. Eg: He was so angry he could hardly ___ himself
restrict;v. hạn chế. Eg: I try to ___ myself / my smoking to five cigarettes a day
result;n. kết quả. Eg: His deafness is the ___ of a car accident
resume;v. nối lại. Eg: After tea, the meeting ___d
retail;v. bán lẻ. Eg: That particular guitar ___s at £750.
retain;v. giữ được, nhớ được. Eg: He finds it difficult to ___ information
retire;v. nghỉ hưu. Eg: He ___d at the age of sixty-five.
retreat;v. rút lui. Eg: After a hard struggle, they were finally forced to ___.
retrieve;v. lấy lại. Eg: My hat blew away, but I managed to ___ it
reveal;v. công bố. Eg: All their secrets have been ___ed.
revenge;n. sự trả thù. Eg: The man told the manager he would get/have his ___ / take ___ on the company for dismissing him
revenue;n. thu nhập
reverse;v. chạy lùi, đảo ngược. Eg: He ___d (the car) into the garage
review;n. bài phê bình. Eg: a film/book ___.
revise;v. sửa lại. Eg: This dictionary has been completely ___d.
revolution;n. cuộc cách mạng. Eg: the American Revolution.
revolve;v. quay tròn. Eg: A wheel ___s on its axle
reward;n. phần thưởng. Eg: He was given a gold watch as a ___ for his services to the firm
rhinoceros;n. con tê giác
rhyme;n. bài thơ ngắn. Eg: a book of ___s for children.
rid;v. tống khứ. Eg: We must try to ___ the town of rats.
riddle;n. câu đố. Eg: Can you guess the answer to this ___?
ride;v. đi, cưỡi. Eg: He ___s to work every day on an old bicycle
ridge;n. chóp, ngọn. Eg: a ___ separating the two canyons.
ridicule;v. chế nhạo. Eg: They ___d him because he was wearing one brown shoe and one black shoe.
ridiculous;adj. buồn cười. Eg: That’s a ___ suggestion
rigid;adj. cứng rắn. Eg: An iron bar is ___.
ring;n. cái nhẫn. Eg: a wedding ___
riot;n. cuộc bạo loạn. Eg: The protest march developed into a ___.
rip;v. xé toạc. Eg: He ___ped his shirt on a branch
ripe;adj. chín. Eg: ___ apples/corn.
risk;n. sự rủi ro. Eg: He thinks we shouldn’t go ahead with the plan because of the ___s involved / because of the ___ of failure.
rite;n. nghi lễ. Eg: marriage ___s.
ritual;n. nghi thức. Eg: Christian ___s
rival;n. đối thủ. Eg: For students of English, this dictionary is without a ___
roam;v. đi lang thang. Eg: He ___ed from town to town
roast;v. nướng. Eg: They are ___ing a chicken over the fire
rob;v. cướp. Eg: He ___bed a bank / an old lady
robe;n. áo choàng. Eg: Many Arabs still wear ___s
robin;n. chim cổ đỏ
robot;n. người máy. Eg: These days the cars are built almost entirely by ___s.
rock;n. đá. Eg: The ship struck a ___ and sank
rod;n. cái que, cái gậy. Eg: an iron ___
romantic;adj. thuộc lãng mạn. Eg: a ___ novel.
rot;v. thối rữa. Eg: The fruit is ___ting on the ground
rotate;v. quay tròn. Eg: He ___d the handle
rough;adj. nhám, ráp. Eg: Her skin felt ___.
route;n. lộ trình. Eg: Our ___ took us through the mountains.
routine;n. thói quen. Eg: her daily ___
row;n. hàng, dãy. Eg: two ___s of houses
royal;adj. thuộc hoàng gia. Eg: the ___ family
rub;v. cọ, rụi. Eg: He ___bed his eyes
rubbish;n. rác. Eg: Our ___ is taken away twice a week
rubble;n. viên sỏi. Eg: The building was reduced to ___ by the explosion.
rugged;adj. gồ ghề. Eg: ___ mountains.
ruin;n. sự đổ nát. Eg: The civil war led to the ___ of the city.
ruins;noun plural. đống đổ nát. Eg: the ___ of the castle.
rule;n. sự thống trị. Eg: The country was under foreign ___ for nearly thirty years.
rupture;n. sự gẫy, sự vỡ. Eg: a ___ of the spleen.
rural;adj. nông thôn. Eg: a ___ area.
rush;v. lao vào. Eg: He ___ed into the room
rust;n. gỉ sắt. Eg: The car was covered with ___.
sacred;adj. thuộc thần thánh. Eg: Temples, mosques, churches, and synagogues are all ___ buildings.
sacrifice;n. sự cúng tế, sự hi sinh. Eg: A lamb was offered in ___.
safety;n. sự an toàn. Eg: I worry about the children’s ___ on these busy roads
sake;vì ai/ cái gì. Eg: He bought a house in the country for the ___ of his wife’s health.
salad;n. rau trộn dầu giấm. Eg: a mixed ___.
salary;n. tiền lương. Eg: Secretarial salaries in London are quite high.
sale;n. sự bán. Eg: the ___ of a house
saliva;n. nước bọt
salmon;n. cá hồi
sanctuary;n. nơi linh thiêng. Eg: the ___ of the god Apollo.
sandwich;n. bánh xăng đuých. Eg: cheese ___es.
sandy;adj. , có cát , phủ cát. Eg: a ___ beach.
satellite;n. vệ tinh. Eg: The Moon is a ___ of the Earth.
satire;n. sự châm biếm. Eg: a ___ on university life.
satisfaction;n. sự thỏa mãn. Eg: the ___ of desires.
satisfactory;adj. vừa ý. Eg: Your work is not ___
satisfied;adj. cảm thấy hài lòng. Eg: I’m ___ with his progress
satisfy;v. làm hài lòng. Eg: The apple didn’t ___ my hunger
saturate;v. làm ướt sũng. Eg: Saturate the earth round the plants.
sausage;n. xúch xích. Eg: We had ___s for breakfast
savage;adj. hoang dã, hung dữ. Eg: ___ tribes.
save;v. cứu nguy. Eg: He ___d his friend from drowning
scale;n. hệ thống chia độ. Eg: This thermometer has two ___s marked on it, one in Fahrenheit and one in Centigrade.
scar;n. sẹo, vết sẹo. Eg: a ___ on the arm where the dog bit him.
scarce;adj. khan hiếm. Eg: Paintings by this artist are very ___
scare;v. làm kinh hãi. Eg: You’ll ___ the baby if you shout
scarf;n. khăn quàng cổ. Eg: a football ___.
scatter;v. làm cho chạy tán loạn. Eg: The sudden noise ___ed the birds
scene;n. quang cảnh, hiện trường. Eg: A murderer sometimes revisits the ___ of his crime
scent;v. đánh hơi, phát hiện, ngửi. Eg: The dog ___ed a cat.
schedule;n. kế hoạch. Eg: a work ___ for next month.
scheme;n. kế hoạch. Eg: a colour ___ for the room
scholar;n. học giả. Eg: a fine classical ___.
scholarship;n. sự học rộng. Eg: a man of great ___.
school;n. trường học. Eg: She goes to the ___
scold;v. rầy la. Eg: She ___ed the child for coming home so late.
scope;n. cơ hội. Eg: There’s no ___ for originality in this job.
scorn;n. sự khinh miệt. Eg: He looked at my drawing with ___.
scorpion;n. con bọ cạp
scramble;v. bò, trườn. Eg: They ___d up the slope
scrap;n. mảnh nhỏ. Eg: a ___ of paper.
scrape;v. làm xây xát. Eg: He drove too close to the wall and ___d his car.
scribble;v. viết chữ cẩu thả. Eg: He ___d a message.
script;n. kịch bản. Eg: Have the actors all got their ___s?
scrutiny;n. sự nghiên cứu kĩ lưỡng. Eg: Famous people live their lives under continuous public ___.
secondhand;adj. cũ, đã dùng rồi. Eg: second-hand clothes.
secrecy;n. tính kín đáo. Eg: Apparently he’s been sworn to ___.
secret;adj. thầm kín, bí mật. Eg: a ___ agreement
secretary;n. thư kí. Eg: He dictated a letter to his ___.
sector;n. hình quạt
secure;adj. an tâm, bảo đảm. Eg: Is your house ___ against burglary?
see;v. nhìn thấy. Eg: After six years of blindness, he found he could ___.
seed;n. hạt giống. Eg: sunflower ___s
seek;v. tìm, tìm kiếm. Eg: He is ___ing (for) an answer
segregate;v. cách li. Eg: At the swimming-pool, the sexes are ___d.
seize;v. túm, nắm. Eg: She ___d the gun from him
seizure;n. sự chiếm đoạt. Eg: the ___ of property.
seldom;adv. hiếm khi. Eg: I’ve ___ experienced such rudeness.
select;v. tuyển chọn, lựa chọn. Eg: She ___ed a blue dress from the wardrobe
sell;v. bán. Eg: He sold her a car
semester;n. học kỳ. Eg: the fall ___.
senate;n. thượng nghị viện. Eg: (also adjective) a ___ committee.
senator;n. thượng nghị sĩ. Eg: Senator Smith.
senior;n. người lớn tuổi hơn, người chức cao hơn. Eg: John is ___ to me by two years
sensation;n. cảm giác (về bên ngoài). Eg: Extreme cold can cause a loss of ___ in the fingers and toes.
sense;n. giác quan. Eg: Dogs have an acute ___ of hearing.
senses;noun plural. sự minh mẫn, sự tỉnh táo. Eg: He must have taken leave of his ___
sensible;adj. có đầu óc xét đoán. Eg: She’s a ___, reliable person
sensitive;adj. nhạy cảm. Eg: ___ skin
sensory;adj. sự cảm biến. Eg: the ___ organs.
sentence;n. câu. Eg: ‘I want it’, and ‘Give it to me!’ are ___s.
separate;v. tách rời ra. Eg: He ___d the money into two piles
sequence;n. chuỗi nhiều sự kiện, con số…. Eg: He described the ___ of events leading to his dismissal from the firm
sergeant;n. trung sĩ. Eg: Sergeant Brown.
serve;v. phục vụ. Eg: He ___d his master for forty years.
service;n. sự phục vụ. Eg: You get very slow ___ in that shop
session;n. phiên họp. Eg: The judge will give his summing up at tomorrow’s court ___.
set;v. đặt , để. Eg: She ___ the tray down on the table.
settle;v. đến nghỉ trên cái gì. Eg: I ___d myself in the armchair.
seven;number. số bảy. Eg: a ___-sided figure.
sever;v. kết thúc. Eg: He ___ed relations with his family.
several;adj. vài, dăm ba. Eg: Several weeks passed before he got a reply to his letter.
severe;adj. gay go, khốc liệt. Eg: ___ shortages of food
sew;v. may, khâu. Eg: She ___ed the pieces together
shade;n. bóng, bóng tối. Eg: I prefer to sit in the ___ rather than the sun.
shadow;n. bóng râm. Eg: We are in the ___ of that building.
shaft;n. cán, tay cầm. Eg: the ___ of a golf club.
shake;v. rung, lắc. Eg: The explosion shook the building
shallow;adj. nông, cạn. Eg: ___ water
shame;n. sự xấu hổ, sự tủi thẹn. Eg: I was full of ___ at my rudeness
shape;n. hình thù. Eg: People are all (of) different ___s and sizes
share;n. phần. Eg: We all had a ___ of the cake
shark;n. cá mập
sharp;adj. sắc, nhọn, bén. Eg: a ___ knife.
shatter;v. vỡ tan. Eg: The stone ___ed the window
shave;v. cạo (râu, mặt, đầu). Eg: He only ___s once a week.
shed;n. nhà một tầng để chứa đồ hoặc làm nhà xưởng. Eg: a wooden ___
sheer;adj. hoàn toàn. Eg: Her singing was a ___ delight
sheet;n. khăn trải gường. Eg: She put clean ___s on all the beds.
shelf;n. giá. Eg: There are shelves on the kitchen walls
shell;n. vỏ, mai. Eg: an egg___
